{
  "$schema": "https://json-schema.org/draft/2020-12/schema",
  "additionalProperties": false,
  "allOf": [
    {
      "if": {
        "properties": {
          "quality": {
            "const": "missing"
          }
        }
      },
      "then": {
        "properties": {
          "value": {
            "type": "null"
          }
        }
      }
    },
    {
      "if": {
        "properties": {
          "quality": {
            "const": "good"
          }
        }
      },
      "then": {
        "properties": {
          "value": {
            "type": "number"
          }
        }
      }
    },
    {
      "if": {
        "properties": {
          "metric": {
            "const": "contact_temperature"
          }
        }
      },
      "then": {
        "properties": {
          "unit": {
            "const": "degC"
          }
        }
      }
    },
    {
      "if": {
        "properties": {
          "metric": {
            "const": "ambient_temperature"
          }
        }
      },
      "then": {
        "properties": {
          "unit": {
            "const": "degC"
          }
        }
      }
    },
    {
      "if": {
        "properties": {
          "metric": {
            "const": "load_fraction"
          }
        }
      },
      "then": {
        "properties": {
          "unit": {
            "const": "fraction"
          }
        }
      }
    },
    {
      "if": {
        "properties": {
          "metric": {
            "const": "closing_time"
          }
        }
      },
      "then": {
        "properties": {
          "unit": {
            "const": "ms"
          }
        }
      }
    },
    {
      "if": {
        "properties": {
          "metric": {
            "const": "relative_pd_indicator"
          }
        }
      },
      "then": {
        "properties": {
          "unit": {
            "const": "dB_ref_demo"
          }
        }
      }
    },
    {
      "if": {
        "properties": {
          "metric": {
            "const": "load_fraction"
          }
        }
      },
      "then": {
        "properties": {
          "value": {
            "maximum": 2,
            "minimum": 0,
            "type": [
              "number",
              "null"
            ]
          }
        }
      }
    }
  ],
  "properties": {
    "assetId": {
      "maxLength": 128,
      "minLength": 1,
      "title": "Assetid",
      "type": "string"
    },
    "eventTime": {
      "format": "date-time",
      "title": "Eventtime",
      "type": "string"
    },
    "measurementId": {
      "maxLength": 128,
      "minLength": 1,
      "title": "Measurementid",
      "type": "string"
    },
    "metric": {
      "enum": [
        "contact_temperature",
        "ambient_temperature",
        "load_fraction",
        "closing_time",
        "relative_pd_indicator"
      ],
      "title": "Metric",
      "type": "string"
    },
    "origin": {
      "enum": [
        "synthetic",
        "field"
      ],
      "title": "Origin",
      "type": "string"
    },
    "quality": {
      "enum": [
        "good",
        "missing",
        "suspect",
        "invalid"
      ],
      "title": "Quality",
      "type": "string"
    },
    "receivedAt": {
      "format": "date-time",
      "title": "Receivedat",
      "type": "string"
    },
    "scenarioRunId": {
      "maxLength": 128,
      "minLength": 1,
      "title": "Scenariorunid",
      "type": "string"
    },
    "schemaVersion": {
      "const": "0.1.0",
      "title": "Schemaversion",
      "type": "string"
    },
    "sourceId": {
      "maxLength": 128,
      "minLength": 1,
      "title": "Sourceid",
      "type": "string"
    },
    "unit": {
      "enum": [
        "degC",
        "fraction",
        "ms",
        "dB_ref_demo"
      ],
      "title": "Unit",
      "type": "string"
    },
    "value": {
      "anyOf": [
        {
          "type": "number"
        },
        {
          "type": "null"
        }
      ],
      "title": "Value"
    }
  },
  "required": [
    "schemaVersion",
    "measurementId",
    "assetId",
    "sourceId",
    "metric",
    "eventTime",
    "receivedAt",
    "value",
    "unit",
    "quality",
    "origin",
    "scenarioRunId"
  ],
  "title": "Measurement",
  "type": "object"
}
