[
  {
    "schemaVersion": "0.1.0",
    "measurementId": "tp177-t1-000000-a",
    "assetId": "tp177-t1",
    "sourceId": "tp177-t1-temp-a",
    "metric": "contact_temperature",
    "eventTime": "2026-06-24T07:40:00Z",
    "receivedAt": "2026-06-24T07:40:16Z",
    "value": 47.7438,
    "unit": "degC",
    "quality": "good",
    "origin": "synthetic",
    "scenarioRunId": "demo-seed-20260925"
  },
  {
    "schemaVersion": "0.1.0",
    "measurementId": "tp177-t1-000001-a",
    "assetId": "tp177-t1",
    "sourceId": "tp177-t1-temp-a",
    "metric": "contact_temperature",
    "eventTime": "2026-06-24T07:45:00Z",
    "receivedAt": "2026-06-24T07:45:14Z",
    "value": 48.0227,
    "unit": "degC",
    "quality": "good",
    "origin": "synthetic",
    "scenarioRunId": "demo-seed-20260925"
  },
  {
    "schemaVersion": "0.1.0",
    "measurementId": "tp177-t1-000002-a",
    "assetId": "tp177-t1",
    "sourceId": "tp177-t1-temp-a",
    "metric": "contact_temperature",
    "eventTime": "2026-06-24T07:50:00Z",
    "receivedAt": "2026-06-24T07:50:00Z",
    "value": 48.3501,
    "unit": "degC",
    "quality": "good",
    "origin": "synthetic",
    "scenarioRunId": "demo-seed-20260925"
  },
  {
    "schemaVersion": "0.1.0",
    "measurementId": "tp177-t1-000003-a",
    "assetId": "tp177-t1",
    "sourceId": "tp177-t1-temp-a",
    "metric": "contact_temperature",
    "eventTime": "2026-06-24T07:55:00Z",
    "receivedAt": "2026-06-24T07:55:14Z",
    "value": 48.5658,
    "unit": "degC",
    "quality": "good",
    "origin": "synthetic",
    "scenarioRunId": "demo-seed-20260925"
  },
  {
    "schemaVersion": "0.1.0",
    "measurementId": "tp177-t1-000004-a",
    "assetId": "tp177-t1",
    "sourceId": "tp177-t1-temp-a",
    "metric": "contact_temperature",
    "eventTime": "2026-06-24T08:00:00Z",
    "receivedAt": "2026-06-24T08:00:03Z",
    "value": 48.7615,
    "unit": "degC",
    "quality": "good",
    "origin": "synthetic",
    "scenarioRunId": "demo-seed-20260925"
  },
  {
    "schemaVersion": "0.1.0",
    "measurementId": "tp177-t1-000005-a",
    "assetId": "tp177-t1",
    "sourceId": "tp177-t1-temp-a",
    "metric": "contact_temperature",
    "eventTime": "2026-06-24T08:05:00Z",
    "receivedAt": "2026-06-24T08:05:17Z",
    "value": 49.0398,
    "unit": "degC",
    "quality": "good",
    "origin": "synthetic",
    "scenarioRunId": "demo-seed-20260925"
  },
  {
    "schemaVersion": "0.1.0",
    "measurementId": "tp177-t1-000006-a",
    "assetId": "tp177-t1",
    "sourceId": "tp177-t1-temp-a",
    "metric": "contact_temperature",
    "eventTime": "2026-06-24T08:10:00Z",
    "receivedAt": "2026-06-24T08:10:17Z",
    "value": 49.3595,
    "unit": "degC",
    "quality": "good",
    "origin": "synthetic",
    "scenarioRunId": "demo-seed-20260925"
  },
  {
    "schemaVersion": "0.1.0",
    "measurementId": "tp177-t1-000007-a",
    "assetId": "tp177-t1",
    "sourceId": "tp177-t1-temp-a",
    "metric": "contact_temperature",
    "eventTime": "2026-06-24T08:15:00Z",
    "receivedAt": "2026-06-24T08:15:19Z",
    "value": 49.4894,
    "unit": "degC",
    "quality": "good",
    "origin": "synthetic",
    "scenarioRunId": "demo-seed-20260925"
  },
  {
    "schemaVersion": "0.1.0",
    "measurementId": "tp177-t1-000008-a",
    "assetId": "tp177-t1",
    "sourceId": "tp177-t1-temp-a",
    "metric": "contact_temperature",
    "eventTime": "2026-06-24T08:20:00Z",
    "receivedAt": "2026-06-24T08:20:04Z",
    "value": 49.9291,
    "unit": "degC",
    "quality": "good",
    "origin": "synthetic",
    "scenarioRunId": "demo-seed-20260925"
  },
  {
    "schemaVersion": "0.1.0",
    "measurementId": "tp177-t1-000009-a",
    "assetId": "tp177-t1",
    "sourceId": "tp177-t1-temp-a",
    "metric": "contact_temperature",
    "eventTime": "2026-06-24T08:25:00Z",
    "receivedAt": "2026-06-24T08:25:19Z",
    "value": 50.1548,
    "unit": "degC",
    "quality": "good",
    "origin": "synthetic",
    "scenarioRunId": "demo-seed-20260925"
  },
  {
    "schemaVersion": "0.1.0",
    "measurementId": "tp177-t1-000010-a",
    "assetId": "tp177-t1",
    "sourceId": "tp177-t1-temp-a",
    "metric": "contact_temperature",
    "eventTime": "2026-06-24T08:30:00Z",
    "receivedAt": "2026-06-24T08:30:00Z",
    "value": 50.3904,
    "unit": "degC",
    "quality": "good",
    "origin": "synthetic",
    "scenarioRunId": "demo-seed-20260925"
  },
  {
    "schemaVersion": "0.1.0",
    "measurementId": "tp177-t1-000011-a",
    "assetId": "tp177-t1",
    "sourceId": "tp177-t1-temp-a",
    "metric": "contact_temperature",
    "eventTime": "2026-06-24T08:35:00Z",
    "receivedAt": "2026-06-24T08:35:19Z",
    "value": 50.7539,
    "unit": "degC",
    "quality": "good",
    "origin": "synthetic",
    "scenarioRunId": "demo-seed-20260925"
  },
  {
    "schemaVersion": "0.1.0",
    "measurementId": "tp177-t1-000012-a",
    "assetId": "tp177-t1",
    "sourceId": "tp177-t1-temp-a",
    "metric": "contact_temperature",
    "eventTime": "2026-06-24T08:40:00Z",
    "receivedAt": "2026-06-24T08:40:10Z",
    "value": 51.084,
    "unit": "degC",
    "quality": "good",
    "origin": "synthetic",
    "scenarioRunId": "demo-seed-20260925"
  },
  {
    "schemaVersion": "0.1.0",
    "measurementId": "tp177-t1-000013-a",
    "assetId": "tp177-t1",
    "sourceId": "tp177-t1-temp-a",
    "metric": "contact_temperature",
    "eventTime": "2026-06-24T08:45:00Z",
    "receivedAt": "2026-06-24T08:45:09Z",
    "value": 50.9662,
    "unit": "degC",
    "quality": "good",
    "origin": "synthetic",
    "scenarioRunId": "demo-seed-20260925"
  },
  {
    "schemaVersion": "0.1.0",
    "measurementId": "tp177-t1-000014-a",
    "assetId": "tp177-t1",
    "sourceId": "tp177-t1-temp-a",
    "metric": "contact_temperature",
    "eventTime": "2026-06-24T08:50:00Z",
    "receivedAt": "2026-06-24T08:50:07Z",
    "value": 51.1277,
    "unit": "degC",
    "quality": "good",
    "origin": "synthetic",
    "scenarioRunId": "demo-seed-20260925"
  },
  {
    "schemaVersion": "0.1.0",
    "measurementId": "tp177-t1-000015-a",
    "assetId": "tp177-t1",
    "sourceId": "tp177-t1-temp-a",
    "metric": "contact_temperature",
    "eventTime": "2026-06-24T08:55:00Z",
    "receivedAt": "2026-06-24T08:55:13Z",
    "value": 51.2484,
    "unit": "degC",
    "quality": "good",
    "origin": "synthetic",
    "scenarioRunId": "demo-seed-20260925"
  },
  {
    "schemaVersion": "0.1.0",
    "measurementId": "tp177-t1-000016-a",
    "assetId": "tp177-t1",
    "sourceId": "tp177-t1-temp-a",
    "metric": "contact_temperature",
    "eventTime": "2026-06-24T09:00:00Z",
    "receivedAt": "2026-06-24T09:00:06Z",
    "value": 51.4844,
    "unit": "degC",
    "quality": "good",
    "origin": "synthetic",
    "scenarioRunId": "demo-seed-20260925"
  },
  {
    "schemaVersion": "0.1.0",
    "measurementId": "tp177-t1-000017-a",
    "assetId": "tp177-t1",
    "sourceId": "tp177-t1-temp-a",
    "metric": "contact_temperature",
    "eventTime": "2026-06-24T09:05:00Z",
    "receivedAt": "2026-06-24T09:05:01Z",
    "value": 51.7056,
    "unit": "degC",
    "quality": "good",
    "origin": "synthetic",
    "scenarioRunId": "demo-seed-20260925"
  },
  {
    "schemaVersion": "0.1.0",
    "measurementId": "tp177-t1-000018-a",
    "assetId": "tp177-t1",
    "sourceId": "tp177-t1-temp-a",
    "metric": "contact_temperature",
    "eventTime": "2026-06-24T09:10:00Z",
    "receivedAt": "2026-06-24T09:10:20Z",
    "value": 51.7905,
    "unit": "degC",
    "quality": "good",
    "origin": "synthetic",
    "scenarioRunId": "demo-seed-20260925"
  },
  {
    "schemaVersion": "0.1.0",
    "measurementId": "tp177-t1-000019-a",
    "assetId": "tp177-t1",
    "sourceId": "tp177-t1-temp-a",
    "metric": "contact_temperature",
    "eventTime": "2026-06-24T09:15:00Z",
    "receivedAt": "2026-06-24T09:15:02Z",
    "value": 52.1146,
    "unit": "degC",
    "quality": "good",
    "origin": "synthetic",
    "scenarioRunId": "demo-seed-20260925"
  },
  {
    "schemaVersion": "0.1.0",
    "measurementId": "tp177-t1-000020-a",
    "assetId": "tp177-t1",
    "sourceId": "tp177-t1-temp-a",
    "metric": "contact_temperature",
    "eventTime": "2026-06-24T09:20:00Z",
    "receivedAt": "2026-06-24T09:20:01Z",
    "value": 52.2263,
    "unit": "degC",
    "quality": "good",
    "origin": "synthetic",
    "scenarioRunId": "demo-seed-20260925"
  },
  {
    "schemaVersion": "0.1.0",
    "measurementId": "tp177-t1-000021-a",
    "assetId": "tp177-t1",
    "sourceId": "tp177-t1-temp-a",
    "metric": "contact_temperature",
    "eventTime": "2026-06-24T09:25:00Z",
    "receivedAt": "2026-06-24T09:25:01Z",
    "value": 52.4089,
    "unit": "degC",
    "quality": "good",
    "origin": "synthetic",
    "scenarioRunId": "demo-seed-20260925"
  },
  {
    "schemaVersion": "0.1.0",
    "measurementId": "tp177-t1-000022-a",
    "assetId": "tp177-t1",
    "sourceId": "tp177-t1-temp-a",
    "metric": "contact_temperature",
    "eventTime": "2026-06-24T09:30:00Z",
    "receivedAt": "2026-06-24T09:30:06Z",
    "value": 52.5717,
    "unit": "degC",
    "quality": "good",
    "origin": "synthetic",
    "scenarioRunId": "demo-seed-20260925"
  },
  {
    "schemaVersion": "0.1.0",
    "measurementId": "tp177-t1-000023-a",
    "assetId": "tp177-t1",
    "sourceId": "tp177-t1-temp-a",
    "metric": "contact_temperature",
    "eventTime": "2026-06-24T09:35:00Z",
    "receivedAt": "2026-06-24T09:35:13Z",
    "value": 52.7794,
    "unit": "degC",
    "quality": "good",
    "origin": "synthetic",
    "scenarioRunId": "demo-seed-20260925"
  },
  {
    "schemaVersion": "0.1.0",
    "measurementId": "tp177-t1-000024-a",
    "assetId": "tp177-t1",
    "sourceId": "tp177-t1-temp-a",
    "metric": "contact_temperature",
    "eventTime": "2026-06-24T09:40:00Z",
    "receivedAt": "2026-06-24T09:40:11Z",
    "value": 53.1615,
    "unit": "degC",
    "quality": "good",
    "origin": "synthetic",
    "scenarioRunId": "demo-seed-20260925"
  },
  {
    "schemaVersion": "0.1.0",